Info	Severity
5759 > 25565 [SYN] Seq=1348861952 Win=0 Len=0	1
14439 > 80 [ACK] Seq=458044343 Win=512 Len=0	1
53 > 57488 [UDP] Seq=0 Win=0 Len=0	0
3676 > 80 [ACK] Seq=83703914 Win=512 Len=0	1
7086 > 80 [ACK] Seq=1880955973 Win=512 Len=0	1
29733 > 25565 [SYN] Seq=1885798400 Win=0 Len=0	1
10191 > 80 [ACK] Seq=337917548 Win=512 Len=0	1
4323 > 80 [SYN] Seq=239050334 Win=512 Len=0	1
14705 > 25565 [SYN] Seq=2609971200 Win=0 Len=0	1
4459 > 80 [ACK] Seq=1548014867 Win=512 Len=0	1
80 > 4954 [SYN] Seq=51737306 Win=29200 Len=0	1
10.0.0.2 > 10.128.0.2 [ICMP] Seq=49038 Win=0 Len=0	1
1542 > 25565 [SYN] Seq=2287534080 Win=0 Len=0	1
53 > 64579 [UDP] Seq=0 Win=0 Len=0	0
49882 > 25565 [SYN] Seq=50200576 Win=0 Len=0	1
80 > 4156 [SYN] Seq=2946942629 Win=29200 Len=0	1
12586 > 80 [ACK] Seq=1050865703 Win=512 Len=0	1
13365 > 80 [ACK] Seq=1774106221 Win=512 Len=0	1
55859 > 25565 [SYN] Seq=3417374720 Win=0 Len=0	1
53 > 49782 [UDP] Seq=0 Win=0 Len=0	0
10.0.0.2 > 10.128.0.2 [ICMP] Seq=62858 Win=0 Len=0	1
57681 > 25565 [SYN] Seq=2550136832 Win=0 Len=0	1
10.0.0.2 > 10.128.0.2 [ICMP] Seq=55438 Win=0 Len=0	1
53 > 63560 [UDP] Seq=0 Win=0 Len=0	0
61415 > 25565 [SYN] Seq=1144455168 Win=0 Len=0	1
52304 > 53 [UDP] Seq=0 Win=0 Len=0	0
60697 > 25565 [SYN] Seq=3732996096 Win=0 Len=0	1
7492 > 80 [ACK] Seq=1052478556 Win=512 Len=0	1
6235 > 25565 [SYN] Seq=2332295168 Win=0 Len=0	1
10.0.0.2 > 10.128.0.2 [ICMP] Seq=14997 Win=0 Len=0	1
10256 > 25565 [SYN] Seq=4108058624 Win=0 Len=0	1
9486 > 80 [ACK] Seq=1889535690 Win=512 Len=0	1
38461 > 25565 [SYN] Seq=3121086464 Win=0 Len=0	1
36740 > 25565 [SYN] Seq=1398013952 Win=0 Len=0	1
53 > 50860 [UDP] Seq=0 Win=0 Len=0	0
54062 > 53 [UDP] Seq=0 Win=0 Len=0	0
39307 > 25565 [SYN] Seq=1523908608 Win=0 Len=0	1
15958 > 25565 [SYN] Seq=2189885440 Win=0 Len=0	1
23945 > 25565 [SYN] Seq=889323520 Win=0 Len=0	1
10.0.0.2 > 10.128.0.2 [ICMP] Seq=53872 Win=0 Len=0	1
80 > 3927 [SYN] Seq=1713639377 Win=29200 Len=0	1
54139 > 53 [UDP] Seq=0 Win=0 Len=0	0
10.0.0.2 > 10.128.0.2 [ICMP] Seq=10874 Win=0 Len=0	1
53 > 62684 [UDP] Seq=0 Win=0 Len=0	0
80 > 3550 [SYN] Seq=1458117736 Win=29200 Len=0	1
53591 > 53 [UDP] Seq=0 Win=0 Len=0	0
54303 > 25565 [SYN] Seq=21495808 Win=0 Len=0	1
80 > 4228 [SYN] Seq=1613677370 Win=29200 Len=0	1
42677 > 25565 [SYN] Seq=4182114304 Win=0 Len=0	1
38854 > 25565 [SYN] Seq=2009530368 Win=0 Len=0	1
53 > 50927 [UDP] Seq=0 Win=0 Len=0	0
32108 > 25565 [SYN] Seq=2398027776 Win=0 Len=0	1
11544 > 25565 [SYN] Seq=2672885760 Win=0 Len=0	1
62582 > 25565 [SYN] Seq=3836149760 Win=0 Len=0	1
3179 > 25565 [SYN] Seq=3719364608 Win=0 Len=0	1
6489 > 80 [ACK] Seq=526633871 Win=512 Len=0	1
56962 > 53 [UDP] Seq=0 Win=0 Len=0	0
53 > 58157 [UDP] Seq=0 Win=0 Len=0	0
31685 > 25565 [SYN] Seq=3688562688 Win=0 Len=0	1
10.0.0.2 > 10.128.0.2 [ICMP] Seq=52372 Win=0 Len=0	1
10740 > 80 [ACK] Seq=2078430646 Win=512 Len=0	1
53 > 55610 [UDP] Seq=0 Win=0 Len=0	0
1815 > 25 [SMTP] Seq=416 Win=22 Len=50 ttl=128 0	0
47913 > 25565 [SYN] Seq=1458569216 Win=0 Len=0	1
55350 > 25565 [SYN] Seq=2004418560 Win=0 Len=0	1
46781 > 25565 [SYN] Seq=3885432832 Win=0 Len=0	1
47966 > 25565 [SYN] Seq=2682585088 Win=0 Len=0	1
62755 > 53 [UDP] Seq=0 Win=0 Len=0	0
39271 > 25565 [SYN] Seq=1457324032 Win=0 Len=0	1
1369 > 25565 [SYN] Seq=437321728 Win=0 Len=0	1
10.0.0.2 > 10.128.0.2 [ICMP] Seq=54669 Win=0 Len=0	1
53 > 62957 [UDP] Seq=0 Win=0 Len=0	0
53688 > 25565 [SYN] Seq=1131937792 Win=0 Len=0	1
15155 > 80 [ACK] Seq=1111306526 Win=512 Len=0	1
9495 > 25565 [SYN] Seq=445644800 Win=0 Len=0	1
10.0.0.2 > 10.128.0.2 [ICMP] Seq=50295 Win=0 Len=0	1
53 > 56094 [UDP] Seq=0 Win=0 Len=0	0
59240 > 25565 [SYN] Seq=3695443968 Win=0 Len=0	1
4495 > 80 [SYN] Seq=550996648 Win=512 Len=0	1
46150 > 25565 [SYN] Seq=1115947008 Win=0 Len=0	1
2583 > 25565 [SYN] Seq=3635150848 Win=0 Len=0	1
2625 > 21 [FTP] Seq=1225 Win=30 Len=342 ttl=64 0	0
80 > 4444 [SYN] Seq=2794873084 Win=29200 Len=0	1
19903 > 25565 [SYN] Seq=3483697152 Win=0 Len=0	1
80 > 3552 [SYN] Seq=1943379359 Win=29200 Len=0	1
2629 > 69 [TFTP] Seq=1229 Win=25 Len=350 ttl=64 0	0
80 > 3457 [SYN] Seq=755333146 Win=29200 Len=0	1
65455 > 25565 [SYN] Seq=774438912 Win=0 Len=0	1
3889 > 80 [ACK] Seq=1296184767 Win=512 Len=0	1
2030 > 80 [ACK] Seq=2047906943 Win=512 Len=0	1
6002 > 25565 [SYN] Seq=2582642688 Win=0 Len=0	1
80 > 4648 [SYN] Seq=1966211108 Win=29200 Len=0	1
8288 > 25565 [SYN] Seq=163446784 Win=0 Len=0	1
53 > 52979 [UDP] Seq=0 Win=0 Len=0	0
53 > 52370 [UDP] Seq=0 Win=0 Len=0	0
6960 > 80 [ACK] Seq=305013923 Win=512 Len=0	1
4561 > 80 [SYN] Seq=963341909 Win=512 Len=0	1
22011 > 25565 [SYN] Seq=832438272 Win=0 Len=0	1
55629 > 25565 [SYN] Seq=3675717632 Win=0 Len=0	1
49061 > 25565 [SYN] Seq=3203334144 Win=0 Len=0	1
80 > 3583 [SYN] Seq=2031574893 Win=29200 Len=0	1
13146 > 80 [ACK] Seq=253214583 Win=512 Len=0	1
64033 > 53 [UDP] Seq=0 Win=0 Len=0	0
34629 > 25565 [SYN] Seq=3053649920 Win=0 Len=0	1
55606 > 53 [UDP] Seq=0 Win=0 Len=0	0
11331 > 25565 [SYN] Seq=986054656 Win=0 Len=0	1
41007 > 25565 [SYN] Seq=2974744576 Win=0 Len=0	1
10121 > 25565 [SYN] Seq=2905407488 Win=0 Len=0	1
10.0.0.2 > 10.128.0.2 [ICMP] Seq=633 Win=0 Len=0	1
8343 > 80 [ACK] Seq=916250630 Win=512 Len=0	1
60685 > 25565 [SYN] Seq=1683947520 Win=0 Len=0	1
80 > 3317 [SYN] Seq=738737676 Win=29200 Len=0	1
58063 > 53 [UDP] Seq=0 Win=0 Len=0	0
13199 > 80 [ACK] Seq=1701095964 Win=512 Len=0	1
64264 > 25565 [SYN] Seq=2882666496 Win=0 Len=0	1
53061 > 53 [UDP] Seq=0 Win=0 Len=0	0
10.0.0.2 > 10.128.0.2 [ICMP] Seq=58991 Win=0 Len=0	1
4651 > 80 [SYN] Seq=469911977 Win=512 Len=0	1
9363 > 80 [ACK] Seq=552182597 Win=512 Len=0	1
80 > 4466 [SYN] Seq=1131133778 Win=29200 Len=0	1
80 > 4365 [SYN] Seq=2674329404 Win=29200 Len=0	1
10.0.0.2 > 10.128.0.2 [ICMP] Seq=28559 Win=0 Len=0	1
17486 > 25565 [SYN] Seq=3103260672 Win=0 Len=0	1
62469 > 53 [UDP] Seq=0 Win=0 Len=0	0
60006 > 25565 [SYN] Seq=1391394816 Win=0 Len=0	1
14949 > 80 [ACK] Seq=341833568 Win=512 Len=0	1
25519 > 25565 [SYN] Seq=3234529280 Win=0 Len=0	1
15435 > 80 [ACK] Seq=110461725 Win=512 Len=0	1
64033 > 25565 [SYN] Seq=3298951168 Win=0 Len=0	1
53 > 52556 [UDP] Seq=0 Win=0 Len=0	0
62072 > 25565 [SYN] Seq=4173594624 Win=0 Len=0	1
10.0.0.2 > 10.128.0.2 [ICMP] Seq=17532 Win=0 Len=0	1
5451 > 25565 [SYN] Seq=1114570752 Win=0 Len=0	1
62666 > 25565 [SYN] Seq=1957036032 Win=0 Len=0	1
53 > 53378 [UDP] Seq=0 Win=0 Len=0	0
58559 > 25565 [SYN] Seq=2576613376 Win=0 Len=0	1
10.0.0.2 > 10.128.0.2 [ICMP] Seq=13943 Win=0 Len=0	1
4470 > 80 [SYN] Seq=2053521065 Win=512 Len=0	1
10.0.0.2 > 10.128.0.2 [ICMP] Seq=13176 Win=0 Len=0	1
65041 > 25565 [SYN] Seq=138543104 Win=0 Len=0	1
15173 > 80 [ACK] Seq=102038245 Win=512 Len=0	1
53 > 61568 [UDP] Seq=0 Win=0 Len=0	0
51778 > 53 [UDP] Seq=0 Win=0 Len=0	0
53 > 57629 [UDP] Seq=0 Win=0 Len=0	0
4103 > 80 [SYN] Seq=803089480 Win=512 Len=0	1
10.0.0.2 > 10.128.0.2 [ICMP] Seq=55957 Win=0 Len=0	1
14099 > 80 [ACK] Seq=215152459 Win=512 Len=0	1
10.0.0.2 > 10.128.0.2 [ICMP] Seq=16019 Win=0 Len=0	1
53 > 52723 [UDP] Seq=0 Win=0 Len=0	0
6160 > 25565 [SYN] Seq=3498246144 Win=0 Len=0	1
44546 > 25565 [SYN] Seq=2321088512 Win=0 Len=0	1
49287 > 53 [UDP] Seq=0 Win=0 Len=0	0
46986 > 25565 [SYN] Seq=2755526656 Win=0 Len=0	1
10.0.0.2 > 10.128.0.2 [ICMP] Seq=22932 Win=0 Len=0	1
10.0.0.2 > 10.128.0.2 [ICMP] Seq=62615 Win=0 Len=0	1
2130 > 25565 [SYN] Seq=3167027200 Win=0 Len=0	1
23028 > 25565 [SYN] Seq=3288072192 Win=0 Len=0	1
18436 > 25565 [SYN] Seq=697565184 Win=0 Len=0	1
80 > 4617 [SYN] Seq=1810367565 Win=29200 Len=0	1
8949 > 80 [ACK] Seq=1134224739 Win=512 Len=0	1
26053 > 25565 [SYN] Seq=3236560896 Win=0 Len=0	1
49271 > 53 [UDP] Seq=0 Win=0 Len=0	0
19518 > 25565 [SYN] Seq=920715264 Win=0 Len=0	1
48769 > 25565 [SYN] Seq=3463577600 Win=0 Len=0	1
22012 > 25565 [SYN] Seq=314310656 Win=0 Len=0	1
10.0.0.2 > 10.128.0.2 [ICMP] Seq=63372 Win=0 Len=0	1
10.0.0.2 > 10.128.0.2 [ICMP] Seq=53651 Win=0 Len=0	1
34293 > 25565 [SYN] Seq=2649358336 Win=0 Len=0	1
3902 > 80 [SYN] Seq=178871173 Win=512 Len=0	1
64291 > 25565 [SYN] Seq=560267264 Win=0 Len=0	1
49582 > 25565 [SYN] Seq=1399521280 Win=0 Len=0	1
10.0.0.2 > 10.128.0.2 [ICMP] Seq=13721 Win=0 Len=0	1
42220 > 25565 [SYN] Seq=3561029632 Win=0 Len=0	1
4363 > 80 [SYN] Seq=1969513236 Win=512 Len=0	1
53 > 49662 [UDP] Seq=0 Win=0 Len=0	0
80 > 4812 [SYN] Seq=2506817471 Win=29200 Len=0	1
46228 > 25565 [SYN] Seq=3237281792 Win=0 Len=0	1
10.0.0.2 > 10.128.0.2 [ICMP] Seq=59547 Win=0 Len=0	1
11061 > 80 [ACK] Seq=2061064744 Win=512 Len=0	1
10.0.0.2 > 10.128.0.2 [ICMP] Seq=8084 Win=0 Len=0	1
60311 > 53 [UDP] Seq=0 Win=0 Len=0	0
3484 > 80 [ACK] Seq=413561042 Win=512 Len=0	1
10.0.0.2 > 10.128.0.2 [ICMP] Seq=378 Win=0 Len=0	1
16298 > 25565 [SYN] Seq=96731136 Win=0 Len=0	1
48159 > 25565 [SYN] Seq=1186267136 Win=0 Len=0	1
64373 > 25565 [SYN] Seq=4231921664 Win=0 Len=0	1
4081 > 25565 [SYN] Seq=3313238016 Win=0 Len=0	1
62472 > 53 [UDP] Seq=0 Win=0 Len=0	0
80 > 3582 [SYN] Seq=2321810200 Win=29200 Len=0	1
34442 > 25565 [SYN] Seq=2736914432 Win=0 Len=0	1
54447 > 53 [UDP] Seq=0 Win=0 Len=0	0
16201 > 80 [ACK] Seq=1325004647 Win=512 Len=0	1
51089 > 25565 [SYN] Seq=3148808192 Win=0 Len=0	1
50372 > 25565 [SYN] Seq=2737963008 Win=0 Len=0	1
53 > 61156 [UDP] Seq=0 Win=0 Len=0	0
28156 > 25565 [SYN] Seq=668073984 Win=0 Len=0	1
50651 > 25565 [SYN] Seq=1364590592 Win=0 Len=0	1
9488 > 80 [ACK] Seq=124695858 Win=512 Len=0	1
10866 > 80 [ACK] Seq=936730317 Win=512 Len=0	1
54754 > 53 [UDP] Seq=0 Win=0 Len=0	0
50218 > 25565 [SYN] Seq=4157341696 Win=0 Len=0	1
10.0.0.2 > 10.128.0.2 [ICMP] Seq=29042 Win=0 Len=0	1
52049 > 53 [UDP] Seq=0 Win=0 Len=0	0
14640 > 25565 [SYN] Seq=221446144 Win=0 Len=0	1
10.0.0.2 > 10.128.0.2 [ICMP] Seq=20357 Win=0 Len=0	1
54967 > 25565 [SYN] Seq=3500867584 Win=0 Len=0	1
56018 > 53 [UDP] Seq=0 Win=0 Len=0	0
10.0.0.2 > 10.128.0.2 [ICMP] Seq=61055 Win=0 Len=0	1
53 > 51031 [UDP] Seq=0 Win=0 Len=0	0
80 > 4183 [SYN] Seq=2939897670 Win=29200 Len=0	1
168 > 25565 [SYN] Seq=1015283712 Win=0 Len=0	1
39851 > 25565 [SYN] Seq=4072210432 Win=0 Len=0	1
23581 > 25565 [SYN] Seq=3458859008 Win=0 Len=0	1
10.0.0.2 > 10.128.0.2 [ICMP] Seq=55424 Win=0 Len=0	1
2797 > 443 [HTTPS] Seq=1397 Win=32 Len=686 ttl=64 0	0
23799 > 25565 [SYN] Seq=3622961152 Win=0 Len=0	1
57454 > 53 [UDP] Seq=0 Win=0 Len=0	0
10.0.0.2 > 10.128.0.2 [ICMP] Seq=4493 Win=0 Len=0	1
63041 > 25565 [SYN] Seq=1109458944 Win=0 Len=0	1
31754 > 25565 [SYN] Seq=335544320 Win=0 Len=0	1
10.0.0.2 > 10.128.0.2 [ICMP] Seq=51331 Win=0 Len=0	1
4922 > 80 [SYN] Seq=1320291090 Win=512 Len=0	1
29823 > 25565 [SYN] Seq=184025088 Win=0 Len=0	1
12248 > 25565 [SYN] Seq=14286848 Win=0 Len=0	1
53 > 64971 [UDP] Seq=0 Win=0 Len=0	0
1632 > 53 [DNS] Seq=233 Win=30 Len=44 ttl=64 0	0
34921 > 25565 [SYN] Seq=496369664 Win=0 Len=0	1
4920 > 80 [ACK] Seq=845328241 Win=512 Len=0	1
53 > 60648 [UDP] Seq=0 Win=0 Len=0	0
62222 > 53 [UDP] Seq=0 Win=0 Len=0	0
2940 > 443 [HTTPS] Seq=1540 Win=32 Len=972 ttl=128 0	0
52059 > 25565 [SYN] Seq=815595520 Win=0 Len=0	1
8644 > 25565 [SYN] Seq=2279604224 Win=0 Len=0	1
53 > 59572 [UDP] Seq=0 Win=0 Len=0	0
11462 > 80 [ACK] Seq=1241709076 Win=512 Len=0	1
52342 > 53 [UDP] Seq=0 Win=0 Len=0	0
4480 > 80 [SYN] Seq=136725752 Win=512 Len=0	1
16528 > 80 [ACK] Seq=1610812984 Win=512 Len=0	1
53 > 57089 [UDP] Seq=0 Win=0 Len=0	0
58904 > 25565 [SYN] Seq=872611840 Win=0 Len=0	1
47008 > 25565 [SYN] Seq=2498560000 Win=0 Len=0	1
10.0.0.2 > 10.128.0.2 [ICMP] Seq=11900 Win=0 Len=0	1
55383 > 25565 [SYN] Seq=3322281984 Win=0 Len=0	1
661 > 25565 [SYN] Seq=426180608 Win=0 Len=0	1
53 > 53811 [UDP] Seq=0 Win=0 Len=0	0
5301 > 80 [ACK] Seq=986324254 Win=512 Len=0	1
26050 > 25565 [SYN] Seq=3905617920 Win=0 Len=0	1
43728 > 25565 [SYN] Seq=2047016960 Win=0 Len=0	1
1966 > 25565 [SYN] Seq=2754019328 Win=0 Len=0	1
10.0.0.2 > 10.128.0.2 [ICMP] Seq=51344 Win=0 Len=0	1
10.0.0.2 > 10.128.0.2 [ICMP] Seq=63610 Win=0 Len=0	1
16049 > 80 [ACK] Seq=723235495 Win=512 Len=0	1
64865 > 53 [UDP] Seq=0 Win=0 Len=0	0
44189 > 25565 [SYN] Seq=3051945984 Win=0 Len=0	1
9085 > 80 [ACK] Seq=1681734885 Win=512 Len=0	1
53967 > 25565 [SYN] Seq=1660747776 Win=0 Len=0	1
50771 > 443 [TCP] Seq=3379816634 Win=0 Len=0	0
10.0.0.2 > 10.128.0.2 [ICMP] Seq=30604 Win=0 Len=0	1
50445 > 53 [UDP] Seq=0 Win=0 Len=0	0
10.0.0.2 > 10.128.0.2 [ICMP] Seq=28289 Win=0 Len=0	1
2988 > 80 [ACK] Seq=603467677 Win=512 Len=0	1
53 > 55058 [UDP] Seq=0 Win=0 Len=0	0
3630 > 80 [SYN] Seq=537737645 Win=512 Len=0	1
57972 > 53 [UDP] Seq=0 Win=0 Len=0	0
61414 > 53 [UDP] Seq=0 Win=0 Len=0	0
25069 > 25565 [SYN] Seq=434044928 Win=0 Len=0	1
12142 > 80 [ACK] Seq=1975993018 Win=512 Len=0	1
53 > 62883 [UDP] Seq=0 Win=0 Len=0	0
63658 > 25565 [SYN] Seq=970981376 Win=0 Len=0	1
59118 > 25565 [SYN] Seq=1923416064 Win=0 Len=0	1
49270 > 53 [UDP] Seq=0 Win=0 Len=0	0
50062 > 53 [UDP] Seq=0 Win=0 Len=0	0
10.0.0.2 > 10.128.0.2 [ICMP] Seq=35729 Win=0 Len=0	1
51652 > 53 [UDP] Seq=0 Win=0 Len=0	0
52627 > 25565 [SYN] Seq=1611137024 Win=0 Len=0	1
10.0.0.2 > 10.128.0.2 [ICMP] Seq=8349 Win=0 Len=0	1
18651 > 25565 [SYN] Seq=758382592 Win=0 Len=0	1
10.0.0.2 > 10.128.0.2 [ICMP] Seq=31618 Win=0 Len=0	1
7178 > 80 [ACK] Seq=964486244 Win=512 Len=0	1
56830 > 53 [UDP] Seq=0 Win=0 Len=0	0
64598 > 25565 [SYN] Seq=2824077312 Win=0 Len=0	1
24464 > 25565 [SYN] Seq=3453747200 Win=0 Len=0	1
58900 > 53 [UDP] Seq=0 Win=0 Len=0	0
51954 > 53 [UDP] Seq=0 Win=0 Len=0	0
7991 > 25565 [SYN] Seq=1402863616 Win=0 Len=0	1
1932 > 53 [DNS] Seq=533 Win=20 Len=55 ttl=64 0	0
80 > 4691 [SYN] Seq=1995020442 Win=29200 Len=0	1
53032 > 53 [UDP] Seq=0 Win=0 Len=0	0
1057 > 25 [SMTP] Seq=58 Win=25 Len=38 ttl=128 0	0
10.0.0.2 > 10.128.0.2 [ICMP] Seq=59531 Win=0 Len=0	1
1459 > 25 [SMTP] Seq=460 Win=32 Len=60 ttl=128 0	0
53 > 49737 [UDP] Seq=0 Win=0 Len=0	0
10.0.0.2 > 10.128.0.2 [ICMP] Seq=3443 Win=0 Len=0	1
10.0.0.2 > 10.128.0.2 [ICMP] Seq=55681 Win=0 Len=0	1
61374 > 25565 [SYN] Seq=2599157760 Win=0 Len=0	1
57866 > 53 [UDP] Seq=0 Win=0 Len=0	0
10.0.0.2 > 10.128.0.2 [ICMP] Seq=13965 Win=0 Len=0	1
3298 > 80 [ACK] Seq=89097479 Win=512 Len=0	1
2856 > 21 [FTP] Seq=1456 Win=30 Len=804 ttl=128 0	0
3748 > 80 [ACK] Seq=1082970689 Win=512 Len=0	1
15339 > 25565 [SYN] Seq=2876112896 Win=0 Len=0	1
43855 > 25565 [SYN] Seq=3057975296 Win=0 Len=0	1
53 > 55136 [UDP] Seq=0 Win=0 Len=0	0
53949 > 25565 [SYN] Seq=3475439616 Win=0 Len=0	1
10.0.0.2 > 10.128.0.2 [ICMP] Seq=7319 Win=0 Len=0	1
10.0.0.2 > 10.128.0.2 [ICMP] Seq=4496 Win=0 Len=0	1
10.0.0.2 > 10.128.0.2 [ICMP] Seq=19826 Win=0 Len=0	1
53 > 50256 [UDP] Seq=0 Win=0 Len=0	0
53 > 53943 [UDP] Seq=0 Win=0 Len=0	0
80 > 4582 [SYN] Seq=3728637199 Win=29200 Len=0	1
53 > 58619 [UDP] Seq=0 Win=0 Len=0	0
1592 > 443 [HTTPS] Seq=193 Win=30 Len=46 ttl=64 0	0
3654 > 80 [SYN] Seq=1860986304 Win=512 Len=0	1
80 > 4814 [SYN] Seq=1780348591 Win=29200 Len=0	1
3735 > 80 [SYN] Seq=1049859015 Win=512 Len=0	1
53200 > 53 [UDP] Seq=0 Win=0 Len=0	0
80 > 4552 [SYN] Seq=3587135713 Win=29200 Len=0	1
2104 > 110 [POP3] Seq=705 Win=30 Len=36 ttl=64 0	0
3807 > 80 [SYN] Seq=434264603 Win=512 Len=0	1
10.0.0.2 > 10.128.0.2 [ICMP] Seq=27518 Win=0 Len=0	1
53 > 55846 [UDP] Seq=0 Win=0 Len=0	0
59782 > 53 [UDP] Seq=0 Win=0 Len=0	0
1750 > 110 [POP3] Seq=351 Win=18 Len=42 ttl=64 0	0
36617 > 25565 [SYN] Seq=369360896 Win=0 Len=0	1
9654 > 25565 [SYN] Seq=3281518592 Win=0 Len=0	1
10.0.0.2 > 10.128.0.2 [ICMP] Seq=32640 Win=0 Len=0	1
62413 > 53 [UDP] Seq=0 Win=0 Len=0	0
45744 > 25565 [SYN] Seq=3382509568 Win=0 Len=0	1
61517 > 53 [UDP] Seq=0 Win=0 Len=0	0
4295 > 80 [SYN] Seq=798852852 Win=512 Len=0	1
2188 > 110 [POP3] Seq=789 Win=20 Len=42 ttl=64 0	0
53 > 57115 [UDP] Seq=0 Win=0 Len=0	0
10.0.0.2 > 10.128.0.2 [ICMP] Seq=2690 Win=0 Len=0	1
17568 > 25565 [SYN] Seq=2819358720 Win=0 Len=0	1
37496 > 25565 [SYN] Seq=434176000 Win=0 Len=0	1
5190 > 80 [ACK] Seq=197653541 Win=512 Len=0	1
4820 > 80 [ACK] Seq=1730376926 Win=512 Len=0	1
4291 > 80 [SYN] Seq=2019489039 Win=512 Len=0	1
8606 > 25565 [SYN] Seq=3621519360 Win=0 Len=0	1
46677 > 25565 [SYN] Seq=1166278656 Win=0 Len=0	1
24831 > 25565 [SYN] Seq=2557345792 Win=0 Len=0	1
80 > 4720 [SYN] Seq=2134426435 Win=29200 Len=0	1
10.0.0.2 > 10.128.0.2 [ICMP] Seq=20356 Win=0 Len=0	1
80 > 4182 [SYN] Seq=983252565 Win=29200 Len=0	1
56979 > 53 [UDP] Seq=0 Win=0 Len=0	0
56772 > 53 [UDP] Seq=0 Win=0 Len=0	0
11951 > 80 [ACK] Seq=174357292 Win=512 Len=0	1
80 > 4980 [SYN] Seq=2834520308 Win=29200 Len=0	1
15029 > 80 [ACK] Seq=1526278459 Win=512 Len=0	1
43515 > 25565 [SYN] Seq=1240399872 Win=0 Len=0	1
4903 > 80 [SYN] Seq=775059335 Win=512 Len=0	1
53 > 55414 [UDP] Seq=0 Win=0 Len=0	0
38924 > 25565 [SYN] Seq=596377600 Win=0 Len=0	1
8466 > 80 [ACK] Seq=1286843586 Win=512 Len=0	1
3920 > 80 [SYN] Seq=991472253 Win=512 Len=0	1
1573 > 143 [IMAP] Seq=174 Win=10 Len=0 0	0
3914 > 80 [SYN] Seq=2128548751 Win=512 Len=0	1
36572 > 25565 [SYN] Seq=200540160 Win=0 Len=0	1
11830 > 80 [ACK] Seq=40317714 Win=512 Len=0	1
53075 > 25565 [SYN] Seq=1063452672 Win=0 Len=0	1
18413 > 25565 [SYN] Seq=3718053888 Win=0 Len=0	1
62986 > 53 [UDP] Seq=0 Win=0 Len=0	0
53474 > 53 [UDP] Seq=0 Win=0 Len=0	0
80 > 4824 [SYN] Seq=2287845042 Win=29200 Len=0	1
18640 > 25565 [SYN] Seq=4115660800 Win=0 Len=0	1
4014 > 80 [SYN] Seq=365963598 Win=512 Len=0	1
80 > 4280 [SYN] Seq=2341993303 Win=29200 Len=0	1
30297 > 25565 [SYN] Seq=2425749504 Win=0 Len=0	1
53 > 60502 [UDP] Seq=0 Win=0 Len=0	0
50722 > 53 [UDP] Seq=0 Win=0 Len=0	0
57756 > 25565 [SYN] Seq=1392115712 Win=0 Len=0	1
10.0.0.2 > 10.128.0.2 [ICMP] Seq=2945 Win=0 Len=0	1
57129 > 53 [UDP] Seq=0 Win=0 Len=0	0
8841 > 80 [ACK] Seq=1244121292 Win=512 Len=0	1
38394 > 25565 [SYN] Seq=924844032 Win=0 Len=0	1
10.0.0.2 > 10.128.0.2 [ICMP] Seq=46215 Win=0 Len=0	1
52864 > 53 [UDP] Seq=0 Win=0 Len=0	0
1619 > 80 [HTTP] Seq=620 Win=22 Len=40 ttl=128 0	0
39060 > 25565 [SYN] Seq=4272422912 Win=0 Len=0	1
40105 > 25565 [SYN] Seq=2245197824 Win=0 Len=0	1
443 > 4531 [PSH, ACK] Seq=65432109 Win=29200 Len=0	0
80 > 4865 [SYN] Seq=259226547 Win=29200 Len=0	1
14764 > 25565 [SYN] Seq=847708160 Win=0 Len=0	1
12939 > 80 [ACK] Seq=749430092 Win=512 Len=0	1
10.0.0.2 > 10.128.0.2 [ICMP] Seq=64897 Win=0 Len=0	1
12212 > 25565 [SYN] Seq=1197932544 Win=0 Len=0	1
43216 > 25565 [SYN] Seq=3009806336 Win=0 Len=0	1
27706 > 25565 [SYN] Seq=1188888576 Win=0 Len=0	1
12323 > 25565 [SYN] Seq=1216544768 Win=0 Len=0	1
15652 > 80 [ACK] Seq=1862417449 Win=512 Len=0	1
53 > 54630 [UDP] Seq=0 Win=0 Len=0	0
2596 > 22 [SSH] Seq=1196 Win=200 Len=408 ttl=128 0	0
44000 > 25565 [SYN] Seq=969998336 Win=0 Len=0	1
63740 > 25565 [SYN] Seq=3742302208 Win=0 Len=0	1
55322 > 53 [UDP] Seq=0 Win=0 Len=0	0
15375 > 25565 [SYN] Seq=4107599872 Win=0 Len=0	1
9136 > 25565 [SYN] Seq=1338769408 Win=0 Len=0	1
80 > 4995 [SYN] Seq=1943352785 Win=29200 Len=0	1
30524 > 25565 [SYN] Seq=883621888 Win=0 Len=0	1
53 > 49706 [UDP] Seq=0 Win=0 Len=0	0
10.0.0.2 > 10.128.0.2 [ICMP] Seq=33937 Win=0 Len=0	1
65504 > 53 [UDP] Seq=0 Win=0 Len=0	0
53023 > 25565 [SYN] Seq=2998009856 Win=0 Len=0	1
80 > 4526 [SYN] Seq=3274185508 Win=29200 Len=0	1
45089 > 25565 [SYN] Seq=1738473472 Win=0 Len=0	1
51765 > 25565 [SYN] Seq=1690173440 Win=0 Len=0	1
42236 > 25565 [SYN] Seq=2765815808 Win=0 Len=0	1
1562 > 53 [DNS] Seq=163 Win=18 Len=52 ttl=64 0	0
53 > 60339 [UDP] Seq=0 Win=0 Len=0	0
59980 > 25565 [SYN] Seq=2619342848 Win=0 Len=0	1
21952 > 25565 [SYN] Seq=1262223360 Win=0 Len=0	1
54938 > 25565 [SYN] Seq=751894528 Win=0 Len=0	1
80 > 4956 [SYN] Seq=2970866699 Win=29200 Len=0	1
22165 > 25565 [SYN] Seq=2205614080 Win=0 Len=0	1
22091 > 25565 [SYN] Seq=3411869696 Win=0 Len=0	1
10.0.0.2 > 10.128.0.2 [ICMP] Seq=9627 Win=0 Len=0	1
3214 > 80 [ACK] Seq=436322667 Win=512 Len=0	1
16300 > 25565 [SYN] Seq=742785024 Win=0 Len=0	1
15230 > 25565 [SYN] Seq=2868838400 Win=0 Len=0	1
4256 > 80 [SYN] Seq=842206498 Win=512 Len=0	1
10.0.0.2 > 10.128.0.2 [ICMP] Seq=8315 Win=0 Len=0	1
50691 > 53 [UDP] Seq=0 Win=0 Len=0	0
23428 > 25565 [SYN] Seq=3417899008 Win=0 Len=0	1
6644 > 80 [ACK] Seq=1383245870 Win=512 Len=0	1
16412 > 25565 [SYN] Seq=1277624320 Win=0 Len=0	1
80 > 4861 [SYN] Seq=3885738510 Win=29200 Len=0	1
62093 > 25565 [SYN] Seq=3765698560 Win=0 Len=0	1
53 > 54335 [UDP] Seq=0 Win=0 Len=0	0
8888 > 80 [ACK] Seq=934316932 Win=512 Len=0	1
10.0.0.2 > 10.128.0.2 [ICMP] Seq=56695 Win=0 Len=0	1
49867 > 53 [UDP] Seq=0 Win=0 Len=0	0
40791 > 25565 [SYN] Seq=1702821888 Win=0 Len=0	1
53 > 63100 [UDP] Seq=0 Win=0 Len=0	0
10.0.0.2 > 10.128.0.2 [ICMP] Seq=56970 Win=0 Len=0	1
53 > 52956 [UDP] Seq=0 Win=0 Len=0	0
30395 > 25565 [SYN] Seq=3632988160 Win=0 Len=0	1
3563 > 80 [ACK] Seq=1326472756 Win=512 Len=0	1
61691 > 25565 [SYN] Seq=1986920448 Win=0 Len=0	1
3204 > 25565 [SYN] Seq=788398080 Win=0 Len=0	1
10.0.0.2 > 10.128.0.2 [ICMP] Seq=19612 Win=0 Len=0	1
2043 > 80 [ACK] Seq=1085409983 Win=512 Len=0	1
50197 > 443 [TCP] Seq=1237624914 Win=0 Len=0	0
62022 > 53 [UDP] Seq=0 Win=0 Len=0	0
63485 > 53 [UDP] Seq=0 Win=0 Len=0	0
53 > 65224 [UDP] Seq=0 Win=0 Len=0	0
6091 > 25565 [SYN] Seq=1343553536 Win=0 Len=0	1
10.0.0.2 > 10.128.0.2 [ICMP] Seq=47741 Win=0 Len=0	1
1653 > 80 [HTTP] Seq=254 Win=28 Len=40 0	0
19639 > 25565 [SYN] Seq=710213632 Win=0 Len=0	1
13771 > 80 [ACK] Seq=632322925 Win=512 Len=0	1
10.0.0.2 > 10.128.0.2 [ICMP] Seq=14490 Win=0 Len=0	1
4799 > 80 [SYN] Seq=1804929072 Win=512 Len=0	1
20027 > 25565 [SYN] Seq=508231680 Win=0 Len=0	1
7119 > 80 [ACK] Seq=1232778180 Win=512 Len=0	1
10.0.0.2 > 10.128.0.2 [ICMP] Seq=49781 Win=0 Len=0	1
80 > 4185 [SYN] Seq=1032411794 Win=29200 Len=0	1
10.0.0.2 > 10.128.0.2 [ICMP] Seq=55693 Win=0 Len=0	1
1701 > 25 [SMTP] Seq=302 Win=25 Len=42 ttl=128 0	0
9956 > 80 [ACK] Seq=682972793 Win=512 Len=0	1
1641 > 80 [HTTP] Seq=242 Win=25 Len=46 ttl=128 0	0
61617 > 25565 [SYN] Seq=3549298688 Win=0 Len=0	1
53 > 54648 [UDP] Seq=0 Win=0 Len=0	0
4761 > 80 [ACK] Seq=50795977 Win=512 Len=0	1
2786 > 80 [ACK] Seq=1751698454 Win=512 Len=0	1
40138 > 25565 [SYN] Seq=3537567744 Win=0 Len=0	1
13038 > 25565 [SYN] Seq=1047265280 Win=0 Len=0	1
3803 > 80 [ACK] Seq=1787219592 Win=512 Len=0	1
46865 > 25565 [SYN] Seq=486080512 Win=0 Len=0	1
10.0.0.2 > 10.128.0.2 [ICMP] Seq=25973 Win=0 Len=0	1
43443 > 25565 [SYN] Seq=687144960 Win=0 Len=0	1
51634 > 25565 [SYN] Seq=3100049408 Win=0 Len=0	1
53 > 57463 [UDP] Seq=0 Win=0 Len=0	0
53 > 53080 [UDP] Seq=0 Win=0 Len=0	0
7687 > 80 [ACK] Seq=551830877 Win=512 Len=0	1
27029 > 25565 [SYN] Seq=3355049984 Win=0 Len=0	1
10.0.0.2 > 10.128.0.2 [ICMP] Seq=43669 Win=0 Len=0	1
3285 > 25565 [SYN] Seq=2494889984 Win=0 Len=0	1
20994 > 25565 [SYN] Seq=266207232 Win=0 Len=0	1
53 > 52648 [UDP] Seq=0 Win=0 Len=0	0
53 > 55718 [UDP] Seq=0 Win=0 Len=0	0
61338 > 25565 [SYN] Seq=3164667904 Win=0 Len=0	1
53 > 63374 [UDP] Seq=0 Win=0 Len=0	0
10.0.0.2 > 10.128.0.2 [ICMP] Seq=30334 Win=0 Len=0	1
10.0.0.2 > 10.128.0.2 [ICMP] Seq=42375 Win=0 Len=0	1
47975 > 25565 [SYN] Seq=3130785792 Win=0 Len=0	1
9601 > 25565 [SYN] Seq=3687448576 Win=0 Len=0	1
12673 > 25565 [SYN] Seq=311820288 Win=0 Len=0	1
58008 > 53 [UDP] Seq=0 Win=0 Len=0	0
21942 > 25565 [SYN] Seq=977403904 Win=0 Len=0	1
15987 > 80 [ACK] Seq=1369290157 Win=512 Len=0	1
53 > 63268 [UDP] Seq=0 Win=0 Len=0	0
10.0.0.2 > 10.128.0.2 [ICMP] Seq=42642 Win=0 Len=0	1
2721 > 25 [SMTP] Seq=1321 Win=20 Len=534 ttl=64 0	0
10.0.0.2 > 10.128.0.2 [ICMP] Seq=32893 Win=0 Len=0	1
32033 > 25565 [SYN] Seq=709885952 Win=0 Len=0	1
11878 > 80 [ACK] Seq=151698153 Win=512 Len=0	1
25120 > 25565 [SYN] Seq=2127691776 Win=0 Len=0	1
49819 > 53 [UDP] Seq=0 Win=0 Len=0	0
49831 > 53 [UDP] Seq=0 Win=0 Len=0	0
59531 > 25565 [SYN] Seq=1394147328 Win=0 Len=0	1
1844 > 443 [HTTPS] Seq=445 Win=20 Len=38 ttl=64 0	0
50516 > 25565 [SYN] Seq=688586752 Win=0 Len=0	1
7213 > 25565 [SYN] Seq=1137836032 Win=0 Len=0	1
64077 > 25565 [SYN] Seq=3972857856 Win=0 Len=0	1
4388 > 25565 [SYN] Seq=3473866752 Win=0 Len=0	1
80 > 4380 [SYN] Seq=2295289816 Win=29200 Len=0	1
53 > 60749 [UDP] Seq=0 Win=0 Len=0	0
52618 > 53 [UDP] Seq=0 Win=0 Len=0	0
80 > 4950 [SYN] Seq=840928584 Win=29200 Len=0	1
62931 > 53 [UDP] Seq=0 Win=0 Len=0	0
9239 > 25565 [SYN] Seq=1072889856 Win=0 Len=0	1
53 > 57273 [UDP] Seq=0 Win=0 Len=0	0
14847 > 80 [ACK] Seq=2031274018 Win=512 Len=0	1
53 > 64813 [UDP] Seq=0 Win=0 Len=0	0
10.0.0.2 > 10.128.0.2 [ICMP] Seq=62611 Win=0 Len=0	1
4519 > 443 [PSH, ACK] Seq=1234567890 Win=512 Len=0	0
30896 > 25565 [SYN] Seq=3907846144 Win=0 Len=0	1
80 > 3451 [SYN] Seq=2626493433 Win=29200 Len=0	1
10.0.0.2 > 10.128.0.2 [ICMP] Seq=37246 Win=0 Len=0	1
80 > 3741 [SYN] Seq=483313473 Win=29200 Len=0	1
58814 > 25565 [SYN] Seq=820772864 Win=0 Len=0	1
36656 > 25565 [SYN] Seq=3033137152 Win=0 Len=0	1
60400 > 53 [UDP] Seq=0 Win=0 Len=0	0
1326 > 25565 [SYN] Seq=2769420288 Win=0 Len=0	1
64464 > 25565 [SYN] Seq=913506304 Win=0 Len=0	1
48279 > 25565 [SYN] Seq=966328320 Win=0 Len=0	1
1365 > 25565 [SYN] Seq=3191144448 Win=0 Len=0	1
24953 > 25565 [SYN] Seq=2065563648 Win=0 Len=0	1
2106 > 25565 [SYN] Seq=726335488 Win=0 Len=0	1
4994 > 25565 [SYN] Seq=3598581760 Win=0 Len=0	1
4692 > 80 [SYN] Seq=2145700293 Win=512 Len=0	1
50733 > 53 [UDP] Seq=0 Win=0 Len=0	0
8862 > 80 [ACK] Seq=1328403817 Win=512 Len=0	1
35159 > 25565 [SYN] Seq=3257860096 Win=0 Len=0	1
44788 > 25565 [SYN] Seq=878772224 Win=0 Len=0	1
53 > 55898 [UDP] Seq=0 Win=0 Len=0	0
9373 > 80 [ACK] Seq=1655415603 Win=512 Len=0	1
53 > 50619 [UDP] Seq=0 Win=0 Len=0	0
64822 > 53 [UDP] Seq=0 Win=0 Len=0	0
53 > 54065 [UDP] Seq=0 Win=0 Len=0	0
39972 > 25565 [SYN] Seq=2299396096 Win=0 Len=0	1
46263 > 25565 [SYN] Seq=2201616384 Win=0 Len=0	1
8132 > 25565 [SYN] Seq=3634429952 Win=0 Len=0	1
12936 > 80 [ACK] Seq=840170952 Win=512 Len=0	1
4485 > 80 [ACK] Seq=599838155 Win=512 Len=0	1
10.0.0.2 > 10.128.0.2 [ICMP] Seq=18328 Win=0 Len=0	1
59492 > 25565 [SYN] Seq=1823080448 Win=0 Len=0	1
28864 > 25565 [SYN] Seq=619642880 Win=0 Len=0	1
53 > 64571 [UDP] Seq=0 Win=0 Len=0	0
6425 > 80 [ACK] Seq=1872736213 Win=512 Len=0	1
2224 > 80 [HTTP] Seq=824 Win=30 Len=40 ttl=128 0	0
80 > 4228 [SYN] Seq=1613677370 Win=29200 Len=0	1
3428 > 25565 [SYN] Seq=4276617216 Win=0 Len=0	1
10.0.0.2 > 10.128.0.2 [ICMP] Seq=18807 Win=0 Len=0	1
60576 > 25565 [SYN] Seq=205324288 Win=0 Len=0	1
10.0.0.2 > 10.128.0.2 [ICMP] Seq=37009 Win=0 Len=0	1
53 > 56966 [UDP] Seq=0 Win=0 Len=0	0
24568 > 25565 [SYN] Seq=269352960 Win=0 Len=0	1
59433 > 53 [UDP] Seq=0 Win=0 Len=0	0
59551 > 25565 [SYN] Seq=3251568640 Win=0 Len=0	1
51970 > 53 [UDP] Seq=0 Win=0 Len=0	0
56097 > 53 [UDP] Seq=0 Win=0 Len=0	0
80 > 3482 [SYN] Seq=3433111698 Win=29200 Len=0	1
10.0.0.2 > 10.128.0.2 [ICMP] Seq=64150 Win=0 Len=0	1
53 > 56347 [UDP] Seq=0 Win=0 Len=0	0
14662 > 80 [ACK] Seq=2054356986 Win=512 Len=0	1
6404 > 80 [ACK] Seq=350139155 Win=512 Len=0	1
60168 > 53 [UDP] Seq=0 Win=0 Len=0	0
8192 > 25565 [SYN] Seq=4241686528 Win=0 Len=0	1
10.0.0.2 > 10.128.0.2 [ICMP] Seq=13691 Win=0 Len=0	1
18345 > 25565 [SYN] Seq=392298496 Win=0 Len=0	1
49378 > 53 [UDP] Seq=0 Win=0 Len=0	0
39322 > 25565 [SYN] Seq=542441472 Win=0 Len=0	1
11095 > 80 [ACK] Seq=2004062093 Win=512 Len=0	1
80 > 4482 [SYN] Seq=2603871699 Win=29200 Len=0	1
10.0.0.2 > 10.128.0.2 [ICMP] Seq=6795 Win=0 Len=0	1
80 > 3749 [SYN] Seq=2816008165 Win=29200 Len=0	1
2333 > 80 [ACK] Seq=1611124357 Win=512 Len=0	1
61819 > 53 [UDP] Seq=0 Win=0 Len=0	0
53 > 63517 [UDP] Seq=0 Win=0 Len=0	0
53 > 59843 [UDP] Seq=0 Win=0 Len=0	0
63344 > 53 [UDP] Seq=0 Win=0 Len=0	0
12026 > 25565 [SYN] Seq=1516699648 Win=0 Len=0	1
55570 > 53 [UDP] Seq=0 Win=0 Len=0	0
10.0.0.2 > 10.128.0.2 [ICMP] Seq=9373 Win=0 Len=0	1
7682 > 80 [ACK] Seq=1578237839 Win=512 Len=0	1
28693 > 25565 [SYN] Seq=4084596736 Win=0 Len=0	1
58191 > 53 [UDP] Seq=0 Win=0 Len=0	0
10214 > 80 [ACK] Seq=752496226 Win=512 Len=0	1
80 > 4620 [SYN] Seq=2771165212 Win=29200 Len=0	1
49758 > 25565 [SYN] Seq=2996436992 Win=0 Len=0	1
5959 > 80 [ACK] Seq=709634625 Win=512 Len=0	1
1602 > 110 [POP3] Seq=203 Win=18 Len=34 0	0
44293 > 25565 [SYN] Seq=872284160 Win=0 Len=0	1
39812 > 25565 [SYN] Seq=1656225792 Win=0 Len=0	1
15830 > 25565 [SYN] Seq=2286223360 Win=0 Len=0	1
39628 > 25565 [SYN] Seq=1877147648 Win=0 Len=0	1
53 > 58340 [UDP] Seq=0 Win=0 Len=0	0
10.0.0.2 > 10.128.0.2 [ICMP] Seq=6779 Win=0 Len=0	1
53 > 54267 [UDP] Seq=0 Win=0 Len=0	0
10.0.0.2 > 10.128.0.2 [ICMP] Seq=27796 Win=0 Len=0	1
4813 > 80 [SYN] Seq=97196325 Win=512 Len=0	1
53 > 58586 [UDP] Seq=0 Win=0 Len=0	0
56854 > 25565 [SYN] Seq=3595370496 Win=0 Len=0	1
10.0.0.2 > 10.128.0.2 [ICMP] Seq=19839 Win=0 Len=0	1
3403 > 80 [ACK] Seq=1605597479 Win=512 Len=0	1
57428 > 53 [UDP] Seq=0 Win=0 Len=0	0
42741 > 25565 [SYN] Seq=1143668736 Win=0 Len=0	1
16978 > 25565 [SYN] Seq=4084727808 Win=0 Len=0	1
9877 > 25565 [SYN] Seq=531169280 Win=0 Len=0	1
60078 > 53 [UDP] Seq=0 Win=0 Len=0	0
53 > 60264 [UDP] Seq=0 Win=0 Len=0	0
10.0.0.2 > 10.128.0.2 [ICMP] Seq=29085 Win=0 Len=0	1
7751 > 25565 [SYN] Seq=3014197248 Win=0 Len=0	1
3511 > 80 [ACK] Seq=1582655485 Win=512 Len=0	1
10.0.0.2 > 10.128.0.2 [ICMP] Seq=33159 Win=0 Len=0	1
32498 > 25565 [SYN] Seq=558891008 Win=0 Len=0	1
7496 > 80 [ACK] Seq=863877943 Win=512 Len=0	1
2853 > 25 [SMTP] Seq=1453 Win=20 Len=798 ttl=64 0	0
10.0.0.2 > 10.128.0.2 [ICMP] Seq=1923 Win=0 Len=0	1
2600 > 80 [ACK] Seq=2143055095 Win=512 Len=0	1
10.0.0.2 > 10.128.0.2 [ICMP] Seq=7034 Win=0 Len=0	1
54888 > 53 [UDP] Seq=0 Win=0 Len=0	0
1851 > 25 [SMTP] Seq=452 Win=32 Len=62 ttl=128 0	0
16612 > 25565 [SYN] Seq=13565952 Win=0 Len=0	1
53 > 53555 [UDP] Seq=0 Win=0 Len=0	0
7710 > 80 [ACK] Seq=1821381650 Win=512 Len=0	1
65416 > 53 [UDP] Seq=0 Win=0 Len=0	0
39739 > 25565 [SYN] Seq=3548971008 Win=0 Len=0	1
36756 > 25565 [SYN] Seq=1310326784 Win=0 Len=0	1
40968 > 25565 [SYN] Seq=4126801920 Win=0 Len=0	1
54004 > 53 [UDP] Seq=0 Win=0 Len=0	0
57488 > 53 [UDP] Seq=0 Win=0 Len=0	0
51874 > 53 [UDP] Seq=0 Win=0 Len=0	0
80 > 4287 [SYN] Seq=2334083532 Win=29200 Len=0	1
45243 > 25565 [SYN] Seq=730136576 Win=0 Len=0	1
10.0.0.2 > 10.128.0.2 [ICMP] Seq=52605 Win=0 Len=0	1
53 > 52580 [UDP] Seq=0 Win=0 Len=0	0
11147 > 80 [ACK] Seq=1134774336 Win=512 Len=0	1
31539 > 25565 [SYN] Seq=2603745280 Win=0 Len=0	1
4563 > 80 [ACK] Seq=2115564653 Win=512 Len=0	1
10642 > 80 [ACK] Seq=1900950557 Win=512 Len=0	1
4328 > 25565 [SYN] Seq=709820416 Win=0 Len=0	1
45625 > 25565 [SYN] Seq=2641100800 Win=0 Len=0	1
41969 > 25565 [SYN] Seq=2421751808 Win=0 Len=0	1
49285 > 25565 [SYN] Seq=301727744 Win=0 Len=0	1
14833 > 80 [ACK] Seq=223532286 Win=512 Len=0	1
10.0.0.2 > 10.128.0.2 [ICMP] Seq=2198 Win=0 Len=0	1
62809 > 25565 [SYN] Seq=2831745024 Win=0 Len=0	1
53 > 54027 [UDP] Seq=0 Win=0 Len=0	0
15754 > 25565 [SYN] Seq=140443648 Win=0 Len=0	1
32485 > 25565 [SYN] Seq=2048000000 Win=0 Len=0	1
19541 > 25565 [SYN] Seq=846135296 Win=0 Len=0	1
2676 > 443 [HTTPS] Seq=1276 Win=32 Len=444 ttl=128 0	0
10.0.0.2 > 10.128.0.2 [ICMP] Seq=28051 Win=0 Len=0	1
46958 > 25565 [SYN] Seq=3539271680 Win=0 Len=0	1
2850 > 53 [DNS] Seq=1450 Win=28 Len=792 ttl=128 0	0
31004 > 25565 [SYN] Seq=203227136 Win=0 Len=0	1
4670 > 80 [SYN] Seq=1634410831 Win=512 Len=0	1
16328 > 80 [ACK] Seq=1459964241 Win=512 Len=0	1
53 > 63769 [UDP] Seq=0 Win=0 Len=0	0
9153 > 25565 [SYN] Seq=3864461312 Win=0 Len=0	1
2560 > 110 [POP3] Seq=1160 Win=128 Len=264 ttl=128 0	0
10.0.0.2 > 10.128.0.2 [ICMP] Seq=44168 Win=0 Len=0	1
53 > 54729 [UDP] Seq=0 Win=0 Len=0	0
57503 > 25565 [SYN] Seq=177471488 Win=0 Len=0	1
24279 > 25565 [SYN] Seq=3545759744 Win=0 Len=0	1
12755 > 80 [ACK] Seq=1617644613 Win=512 Len=0	1
53 > 52806 [UDP] Seq=0 Win=0 Len=0	0
10.0.0.2 > 10.128.0.2 [ICMP] Seq=25984 Win=0 Len=0	1
26867 > 25565 [SYN] Seq=3580755968 Win=0 Len=0	1
1643 > 143 [IMAP] Seq=244 Win=32 Len=58 ttl=128 0	0
21542 > 25565 [SYN] Seq=417136640 Win=0 Len=0	1
1724 > 25565 [SYN] Seq=2575171584 Win=0 Len=0	1
35999 > 25565 [SYN] Seq=1078657024 Win=0 Len=0	1
10.0.0.2 > 10.128.0.2 [ICMP] Seq=8304 Win=0 Len=0	1
80 > 3724 [SYN] Seq=866825373 Win=29200 Len=0	1
80 > 3958 [SYN] Seq=633512972 Win=29200 Len=0	1
10.0.0.2 > 10.128.0.2 [ICMP] Seq=4239 Win=0 Len=0	1
6875 > 80 [ACK] Seq=1873165199 Win=512 Len=0	1
80 > 3328 [SYN] Seq=3062047050 Win=29200 Len=0	1
2599 > 443 [HTTPS] Seq=1199 Win=32 Len=290 ttl=64 0	0
10.0.0.2 > 10.128.0.2 [ICMP] Seq=51858 Win=0 Len=0	1
2346 > 80 [ACK] Seq=617591696 Win=512 Len=0	1
29330 > 25565 [SYN] Seq=3728408576 Win=0 Len=0	1
46473 > 25565 [SYN] Seq=1006174208 Win=0 Len=0	1
53 > 52202 [UDP] Seq=0 Win=0 Len=0	0
5357 > 25565 [SYN] Seq=3895394304 Win=0 Len=0	1
10.0.0.2 > 10.128.0.2 [ICMP] Seq=15773 Win=0 Len=0	1
9736 > 25565 [SYN] Seq=1920270336 Win=0 Len=0	1
10.0.0.2 > 10.128.0.2 [ICMP] Seq=43921 Win=0 Len=0	1
2108 > 80 [ACK] Seq=790695320 Win=512 Len=0	1
58859 > 25565 [SYN] Seq=904593408 Win=0 Len=0	1
7401 > 25565 [SYN] Seq=1720057856 Win=0 Len=0	1
53 > 50633 [UDP] Seq=0 Win=0 Len=0	0
33724 > 25565 [SYN] Seq=203358208 Win=0 Len=0	1
7653 > 80 [ACK] Seq=1094498477 Win=512 Len=0	1
53 > 56337 [UDP] Seq=0 Win=0 Len=0	0
63855 > 25565 [SYN] Seq=748683264 Win=0 Len=0	1
31125 > 25565 [SYN] Seq=2393243648 Win=0 Len=0	1
57531 > 53 [UDP] Seq=0 Win=0 Len=0	0
80 > 3768 [SYN] Seq=2586788589 Win=29200 Len=0	1
5995 > 80 [ACK] Seq=48054251 Win=512 Len=0	1
10.0.0.2 > 10.128.0.2 [ICMP] Seq=11669 Win=0 Len=0	1
10.0.0.2 > 10.128.0.2 [ICMP] Seq=660 Win=0 Len=0	1
9472 > 25565 [SYN] Seq=2991390720 Win=0 Len=0	1
1485 > 143 [IMAP] Seq=486 Win=25 Len=40 ttl=128 0	0
10.0.0.2 > 10.128.0.2 [ICMP] Seq=17288 Win=0 Len=0	1
62798 > 53 [UDP] Seq=0 Win=0 Len=0	0
2793 > 161 [SNMP] Seq=1393 Win=32 Len=678 ttl=64 0	0
60104 > 53 [UDP] Seq=0 Win=0 Len=0	0
43878 > 25565 [SYN] Seq=2275016704 Win=0 Len=0	1
15430 > 80 [ACK] Seq=827894684 Win=512 Len=0	1
12735 > 25565 [SYN] Seq=814481408 Win=0 Len=0	1
60061 > 25565 [SYN] Seq=2947809280 Win=0 Len=0	1
53 > 51234 [UDP] Seq=0 Win=0 Len=0	0
1749 > 25 [SMTP] Seq=350 Win=25 Len=40 ttl=128 0	0
9490 > 25565 [SYN] Seq=82509824 Win=0 Len=0	1
3175 > 80 [ACK] Seq=1519426590 Win=512 Len=0	1
53 > 64457 [UDP] Seq=0 Win=0 Len=0	0
13812 > 25565 [SYN] Seq=94175232 Win=0 Len=0	1
10.0.0.2 > 10.128.0.2 [ICMP] Seq=31347 Win=0 Len=0	1
10.0.0.2 > 10.128.0.2 [ICMP] Seq=58774 Win=0 Len=0	1
53 > 50797 [UDP] Seq=0 Win=0 Len=0	0
80 > 4235 [SYN] Seq=11252990 Win=29200 Len=0	1
58999 > 25565 [SYN] Seq=1283981312 Win=0 Len=0	1
37875 > 25565 [SYN] Seq=633208832 Win=0 Len=0	1
80 > 4403 [SYN] Seq=2262078021 Win=29200 Len=0	1
10.0.0.2 > 10.128.0.2 [ICMP] Seq=2418 Win=0 Len=0	1
1565 > 25 [SMTP] Seq=166 Win=10 Len=0 0	0
60331 > 53 [UDP] Seq=0 Win=0 Len=0	0
44901 > 25565 [SYN] Seq=4113563648 Win=0 Len=0	1
80 > 4936 [SYN] Seq=2381209042 Win=29200 Len=0	1
10.0.0.2 > 10.128.0.2 [ICMP] Seq=17268 Win=0 Len=0	1
4444 > 80 [SYN] Seq=1198814295 Win=512 Len=0	1
644 > 25565 [SYN] Seq=649658368 Win=0 Len=0	1
80 > 4847 [SYN] Seq=4068652572 Win=29200 Len=0	1
53 > 63606 [UDP] Seq=0 Win=0 Len=0	0
53 > 56181 [UDP] Seq=0 Win=0 Len=0	0
50083 > 25565 [SYN] Seq=1269366784 Win=0 Len=0	1
80 > 3911 [SYN] Seq=3893471321 Win=29200 Len=0	1
64279 > 53 [UDP] Seq=0 Win=0 Len=0	0
8265 > 80 [ACK] Seq=1325180219 Win=512 Len=0	1
64991 > 25565 [SYN] Seq=4167368704 Win=0 Len=0	1
49541 > 53 [UDP] Seq=0 Win=0 Len=0	0
63919 > 53 [UDP] Seq=0 Win=0 Len=0	0
13690 > 80 [ACK] Seq=1899613436 Win=512 Len=0	1
6467 > 25565 [SYN] Seq=3127508992 Win=0 Len=0	1
10.0.0.2 > 10.128.0.2 [ICMP] Seq=13182 Win=0 Len=0	1
13113 > 80 [ACK] Seq=422952662 Win=512 Len=0	1
80 > 3698 [SYN] Seq=1661991242 Win=29200 Len=0	1
52779 > 25565 [SYN] Seq=807469056 Win=0 Len=0	1
52839 > 53 [UDP] Seq=0 Win=0 Len=0	0
53237 > 53 [UDP] Seq=0 Win=0 Len=0	0
42636 > 25565 [SYN] Seq=4231200768 Win=0 Len=0	1
10.0.0.2 > 10.128.0.2 [ICMP] Seq=36466 Win=0 Len=0	1
18675 > 25565 [SYN] Seq=1037369344 Win=0 Len=0	1
37312 > 25565 [SYN] Seq=630587392 Win=0 Len=0	1
13400 > 80 [ACK] Seq=152662774 Win=512 Len=0	1
1672 > 443 [HTTPS] Seq=273 Win=20 Len=50 ttl=64 0	0
80 > 3230 [SYN] Seq=918135261 Win=29200 Len=0	1
38137 > 25565 [SYN] Seq=3816292352 Win=0 Len=0	1
14700 > 80 [ACK] Seq=419195147 Win=512 Len=0	1
3768 > 80 [SYN] Seq=995188182 Win=512 Len=0	1
60184 > 53 [UDP] Seq=0 Win=0 Len=0	0
54344 > 53 [UDP] Seq=0 Win=0 Len=0	0
10.0.0.2 > 10.128.0.2 [ICMP] Seq=34683 Win=0 Len=0	1
2051 > 80 [ACK] Seq=831627629 Win=512 Len=0	1
61107 > 53 [UDP] Seq=0 Win=0 Len=0	0
2559 > 25565 [SYN] Seq=2271215616 Win=0 Len=0	1
3705 > 80 [SYN] Seq=569368642 Win=512 Len=0	1
54803 > 25565 [SYN] Seq=1202716672 Win=0 Len=0	1
14580 > 80 [ACK] Seq=531714578 Win=512 Len=0	1
20617 > 25565 [SYN] Seq=4171956224 Win=0 Len=0	1
10.0.0.2 > 10.128.0.2 [ICMP] Seq=33919 Win=0 Len=0	1
32594 > 25565 [SYN] Seq=2664103936 Win=0 Len=0	1
53 > 58532 [UDP] Seq=0 Win=0 Len=0	0
9822 > 80 [ACK] Seq=833922432 Win=512 Len=0	1
60154 > 53 [UDP] Seq=0 Win=0 Len=0	0
10.0.0.2 > 10.128.0.2 [ICMP] Seq=21396 Win=0 Len=0	1
61873 > 25565 [SYN] Seq=595001344 Win=0 Len=0	1
10.0.0.2 > 10.128.0.2 [ICMP] Seq=7069 Win=0 Len=0	1
60189 > 53 [UDP] Seq=0 Win=0 Len=0	0
10.0.0.2 > 10.128.0.2 [ICMP] Seq=31361 Win=0 Len=0	1
53 > 53908 [UDP] Seq=0 Win=0 Len=0	0
28095 > 25565 [SYN] Seq=3935633408 Win=0 Len=0	1
9158 > 80 [ACK] Seq=55060906 Win=512 Len=0	1
1989 > 80 [ACK] Seq=1344679647 Win=512 Len=0	1
4240 > 80 [SYN] Seq=1822393434 Win=512 Len=0	1
13527 > 25565 [SYN] Seq=2324496384 Win=0 Len=0	1
11502 > 80 [ACK] Seq=1625830429 Win=512 Len=0	1
2836 > 123 [NTP] Seq=1436 Win=35 Len=764 ttl=128 0	0
2801 > 21 [FTP] Seq=1401 Win=30 Len=694 ttl=64 0	0
59007 > 53 [UDP] Seq=0 Win=0 Len=0	0
23132 > 25565 [SYN] Seq=4098031616 Win=0 Len=0	1
10.0.0.2 > 10.128.0.2 [ICMP] Seq=50327 Win=0 Len=0	1
2627 > 80 [ACK] Seq=1238562381 Win=512 Len=0	1
6568 > 80 [ACK] Seq=812105474 Win=512 Len=0	1
53 > 57646 [UDP] Seq=0 Win=0 Len=0	0
2715 > 123 [NTP] Seq=1315 Win=35 Len=522 ttl=64 0	0
53 > 56976 [UDP] Seq=0 Win=0 Len=0	0
14808 > 80 [ACK] Seq=974221930 Win=512 Len=0	1
58110 > 25565 [SYN] Seq=3825860608 Win=0 Len=0	1
56528 > 53 [UDP] Seq=0 Win=0 Len=0	0
42669 > 25565 [SYN] Seq=3281780736 Win=0 Len=0	1
61605 > 53 [UDP] Seq=0 Win=0 Len=0	0
38457 > 25565 [SYN] Seq=3247505408 Win=0 Len=0	1
2574 > 80 [ACK] Seq=219799324 Win=512 Len=0	1
59920 > 53 [UDP] Seq=0 Win=0 Len=0	0
6116 > 80 [ACK] Seq=967092570 Win=512 Len=0	1
5137 > 25565 [SYN] Seq=3850895360 Win=0 Len=0	1
43957 > 25565 [SYN] Seq=702021632 Win=0 Len=0	1
10.0.0.2 > 10.128.0.2 [ICMP] Seq=37771 Win=0 Len=0	1
5846 > 25565 [SYN] Seq=1549008896 Win=0 Len=0	1
18554 > 25565 [SYN] Seq=1150943232 Win=0 Len=0	1
53 > 56909 [UDP] Seq=0 Win=0 Len=0	0
34491 > 25565 [SYN] Seq=3295739904 Win=0 Len=0	1
80 > 4209 [SYN] Seq=393139014 Win=29200 Len=0	1
53 > 51956 [UDP] Seq=0 Win=0 Len=0	0
54448 > 53 [UDP] Seq=0 Win=0 Len=0	0
19020 > 25565 [SYN] Seq=640548864 Win=0 Len=0	1
53356 > 53 [UDP] Seq=0 Win=0 Len=0	0
49774 > 443 [TCP] Seq=3888904560 Win=0 Len=0	0
10.0.0.2 > 10.128.0.2 [ICMP] Seq=33908 Win=0 Len=0	1
2145 > 80 [ACK] Seq=1849532943 Win=512 Len=0	1
25976 > 25565 [SYN] Seq=3124035584 Win=0 Len=0	1
5700 > 25565 [SYN] Seq=3392405504 Win=0 Len=0	1
25184 > 25565 [SYN] Seq=2735079424 Win=0 Len=0	1
60648 > 53 [UDP] Seq=0 Win=0 Len=0	0
80 > 3715 [SYN] Seq=87310333 Win=29200 Len=0	1
9349 > 80 [ACK] Seq=481681506 Win=512 Len=0	1
10.0.0.2 > 10.128.0.2 [ICMP] Seq=55663 Win=0 Len=0	1
10.0.0.2 > 10.128.0.2 [ICMP] Seq=10652 Win=0 Len=0	1
2176 > 25565 [SYN] Seq=356319232 Win=0 Len=0	1
33434 > 25565 [SYN] Seq=2542927872 Win=0 Len=0	1
57084 > 53 [UDP] Seq=0 Win=0 Len=0	0
53 > 50070 [UDP] Seq=0 Win=0 Len=0	0
33262 > 25565 [SYN] Seq=882114560 Win=0 Len=0	1
19578 > 25565 [SYN] Seq=1897594880 Win=0 Len=0	1
35319 > 25565 [SYN] Seq=2313355264 Win=0 Len=0	1
9715 > 80 [ACK] Seq=2123214918 Win=512 Len=0	1
1742 > 25565 [SYN] Seq=731774976 Win=0 Len=0	1
6125 > 25565 [SYN] Seq=1489371136 Win=0 Len=0	1
18762 > 25565 [SYN] Seq=1905590272 Win=0 Len=0	1
34059 > 25565 [SYN] Seq=1811611648 Win=0 Len=0	1
80 > 3839 [SYN] Seq=4226510691 Win=29200 Len=0	1
34033 > 25565 [SYN] Seq=576978944 Win=0 Len=0	1
3094 > 80 [ACK] Seq=1633986721 Win=512 Len=0	1
53 > 64078 [UDP] Seq=0 Win=0 Len=0	0
7295 > 25565 [SYN] Seq=1426391040 Win=0 Len=0	1
41368 > 25565 [SYN] Seq=3576627200 Win=0 Len=0	1
10.0.0.2 > 10.128.0.2 [ICMP] Seq=60821 Win=0 Len=0	1
6552 > 80 [ACK] Seq=1737360572 Win=512 Len=0	1
80 > 3667 [SYN] Seq=992893821 Win=29200 Len=0	1
15533 > 25565 [SYN] Seq=1774780416 Win=0 Len=0	1
52362 > 53 [UDP] Seq=0 Win=0 Len=0	0
53 > 49379 [UDP] Seq=0 Win=0 Len=0	0
7671 > 80 [ACK] Seq=24203871 Win=512 Len=0	1
12484 > 80 [ACK] Seq=444027001 Win=512 Len=0	1
61292 > 53 [UDP] Seq=0 Win=0 Len=0	0
36184 > 25565 [SYN] Seq=3051618304 Win=0 Len=0	1
